{
  "schema_version": "0.3.0",
  "layer": "causal DAGs + published results (the app's data contract)",
  "vintage_date": "2026-10-18",
  "generated_at": "2026-10-18T12:37:07+0100",
  "generator": {
    "script": "analysis/R/01_build_dags.R",
    "git_sha": "1295af7"
  },
  "diagnostics": {
    "vintage": "2026-10-18",
    "source": "registry/diagnostics/2026-10-18/diagnostics.json",
    "spec": "analysis/specs/diagnostics.yml",
    "design_verdicts": {
      "A": {
        "design_id": "A",
        "status": "dropped",
        "gates": {
          "dose_variation": {
            "passed": false,
            "detail": "D1: 0 of 12358 panel values across 37 states — other axes present: D1_nominal"
          },
          "state_outcome_attribution": {
            "passed": true,
            "detail": "21238 of 12358 state outcome values present"
          }
        },
        "blocker": "specified_dose_axis_absent:D1",
        "dropped_because": "the FAAC dose has landed and is Stage 3 gated, but on the **nominal** axis: the estimand is written on D1 (per capita), which needs the state population denominator decision (X-09).  The state-attributed outcome HAS landed (UCDP GED, C-45), so what is left is the denominator decision and the choice of dose axis — Stage 6 ran the nominal-axis version and reported it `estimated_not_identified` (registry/estimates/)",
        "diagnostics_that_decide": [
          "dose_variation",
          "state_outcome_attribution"
        ],
        "next_step": "the state population denominator decision (X-09), which is what the specified axis D1 waits on. The outcome blocker is cleared: the state-attributed security series landed 2026-10-17",
        "card_status_counts": {
          "fail": 12
        },
        "n_outcomes_pass": 0,
        "n_outcomes_attempted": 12,
        "status_basis": "computed from the 12 cards: fail=12"
      },
      "B": {
        "design_id": "B",
        "status": "degraded",
        "gates": {
          "integration_order": {
            "passed": null,
            "detail": "24 series tested at native grain"
          },
          "cointegration_rank": {
            "passed": null,
            "detail": "4 outcomes tested"
          },
          "dof_minimum": {
            "passed": null,
            "detail": "0 outcomes infeasible at 3 residual DoF"
          },
          "collinearity": {
            "passed": null,
            "detail": "0 outcomes fail VIF >= 30"
          }
        },
        "blocker": "FAAC is absent from the metric catalogue, so the Tier-3 system runs without its fiscal variable; and the grain is annual, not monthly",
        "degraded_because": "base spec section 9 specifies oil + FAAC + FX + lags + trend at monthly grain; the testable system is {Y, log(oil), fx} at annual grain",
        "diagnostics_that_decide": [
          "integration_order",
          "cointegration_rank",
          "dof_minimum",
          "collinearity"
        ],
        "next_step": "a metric-catalogue entry for the FAAC panel (landed and gated, but with no declared monthly-to-annual aggregation), and a decision on whether an annual-grain estimate is worth publishing",
        "card_status_counts": {
          "degraded": 9,
          "not_attempted": 3
        },
        "n_outcomes_pass": 0,
        "n_outcomes_attempted": 9,
        "status_basis": "computed from the 12 cards: degraded=9, not_attempted=3"
      },
      "C": {
        "design_id": "C",
        "status": "candidate",
        "gates": {
          "pretreatment_fit": {
            "passed": null,
            "detail": "1 outcomes pass the pre-fit threshold of 0.10 x pre-period SD"
          },
          "donor_pool_coverage": {
            "passed": true,
            "detail": "99 donor countries x 5 predictors"
          }
        },
        "blocker": null,
        "diagnostics_that_decide": "pretreatment_fit",
        "next_step": "Stage 6 fits the synthetic control where pre-fit passes",
        "card_status_counts": {
          "fail": 2,
          "not_attempted": 9,
          "pass": 1
        },
        "n_outcomes_pass": 1,
        "n_outcomes_attempted": 3,
        "status_basis": "computed from the 12 cards: fail=2, not_attempted=9, pass=1"
      }
    },
    "status_counts": {
      "degraded": 9,
      "fail": 14,
      "not_attempted": 12,
      "pass": 1
    }
  },
  "counts": {
    "outcomes": 12,
    "designs": 3,
    "dags": 36
  },
  "designs": [
    {
      "id": "A",
      "name": "State dose-response DiD",
      "short": "DiD",
      "unit": "state-month (36 states + FCT)",
      "estimand": "ATT of a federal policy shift, with state exposure intensity as the dose"
    },
    {
      "id": "B",
      "name": "National VECM / ARDL time series",
      "short": "Time series",
      "unit": "national-month (annual cross-check)",
      "estimand": "long-run multiplier for the administration effect, oil-interacted"
    },
    {
      "id": "C",
      "name": "Synthetic control (cross-country)",
      "short": "Synthetic control",
      "unit": "country-year (Nigeria treated; West African neighbours + oil exporters)",
      "estimand": "treatment gap: Nigeria outcome minus synthetic Nigeria"
    }
  ],
  "outcomes": [
    {
      "id": "u5mr",
      "label": "Under-5 mortality rate",
      "domain": "health",
      "direction": "down",
      "coverage_status": "partial"
    },
    {
      "id": "mmr",
      "label": "Maternal mortality ratio",
      "domain": "health",
      "direction": "down",
      "coverage_status": "ok"
    },
    {
      "id": "immun_penta3",
      "label": "Penta3 immunisation coverage",
      "domain": "health",
      "direction": "up",
      "coverage_status": "partial"
    },
    {
      "id": "skilled_birth",
      "label": "Skilled birth attendance",
      "domain": "health",
      "direction": "up",
      "coverage_status": "partial"
    },
    {
      "id": "literacy_youth",
      "label": "Youth literacy (15-24)",
      "domain": "education",
      "direction": "up",
      "coverage_status": "declared_gap"
    },
    {
      "id": "primary_completion",
      "label": "Primary completion rate",
      "domain": "education",
      "direction": "up",
      "coverage_status": "declared_gap"
    },
    {
      "id": "ner_primary",
      "label": "Net enrolment rate, primary",
      "domain": "education",
      "direction": "up",
      "coverage_status": "declared_gap"
    },
    {
      "id": "fatalities",
      "label": "Reported security fatalities",
      "domain": "security",
      "direction": "down",
      "coverage_status": "ok"
    },
    {
      "id": "incidents",
      "label": "Reported security incidents",
      "domain": "security",
      "direction": "down",
      "coverage_status": "ok"
    },
    {
      "id": "gdp_growth",
      "label": "Real GDP growth (y/y)",
      "domain": "economy",
      "direction": "up",
      "coverage_status": "ok"
    },
    {
      "id": "cpi_yoy",
      "label": "Headline inflation (y/y)",
      "domain": "economy",
      "direction": "down",
      "coverage_status": "ok"
    },
    {
      "id": "unemp",
      "label": "Unemployment rate",
      "domain": "economy",
      "direction": "down",
      "coverage_status": "partial"
    }
  ],
  "dags": [
    {
      "dag_id": "u5mr__A",
      "outcome_id": "u5mr",
      "design_id": "A",
      "svg": "registry/dags/u5mr__A.svg",
      "adjustment_set": [
        "donor",
        "inherit",
        "oil",
        "statefe",
        "timefe"
      ],
      "assumption_required": [
        "u_st"
      ],
      "diagnostics_status": "fail",
      "diagnostics_blocker": "specified_dose_axis_absent:D1"
    },
    {
      "dag_id": "u5mr__B",
      "outcome_id": "u5mr",
      "design_id": "B",
      "svg": "registry/dags/u5mr__B.svg",
      "adjustment_set": [
        "oil"
      ],
      "assumption_required": [
        "u_t"
      ],
      "diagnostics_status": "degraded",
      "diagnostics_blocker": "FAAC is absent from the metric catalogue, so the Tier-3 system runs without its fiscal variable; and the grain is annual, not monthly"
    },
    {
      "dag_id": "u5mr__C",
      "outcome_id": "u5mr",
      "design_id": "C",
      "svg": "registry/dags/u5mr__C.svg",
      "adjustment_set": [
        "common"
      ],
      "assumption_required": [
        "u_ng"
      ],
      "diagnostics_status": "pass",
      "diagnostics_blocker": null
    },
    {
      "dag_id": "mmr__A",
      "outcome_id": "mmr",
      "design_id": "A",
      "svg": "registry/dags/mmr__A.svg",
      "adjustment_set": [
        "donor",
        "inherit",
        "oil",
        "statefe",
        "timefe"
      ],
      "assumption_required": [
        "u_st"
      ],
      "diagnostics_status": "fail",
      "diagnostics_blocker": "specified_dose_axis_absent:D1"
    },
    {
      "dag_id": "mmr__B",
      "outcome_id": "mmr",
      "design_id": "B",
      "svg": "registry/dags/mmr__B.svg",
      "adjustment_set": [
        "oil"
      ],
      "assumption_required": [
        "u_t"
      ],
      "diagnostics_status": "degraded",
      "diagnostics_blocker": "FAAC is absent from the metric catalogue, so the Tier-3 system runs without its fiscal variable; and the grain is annual, not monthly"
    },
    {
      "dag_id": "mmr__C",
      "outcome_id": "mmr",
      "design_id": "C",
      "svg": "registry/dags/mmr__C.svg",
      "adjustment_set": [
        "common"
      ],
      "assumption_required": [
        "u_ng"
      ],
      "diagnostics_status": "not_attempted",
      "diagnostics_blocker": "outcome mmr is not in the donor panel (predictors: cpi_yoy, gdp_growth, oil_rents, population, u5mr)"
    },
    {
      "dag_id": "immun_penta3__A",
      "outcome_id": "immun_penta3",
      "design_id": "A",
      "svg": "registry/dags/immun_penta3__A.svg",
      "adjustment_set": [
        "donor",
        "inherit",
        "oil",
        "statefe",
        "timefe"
      ],